titles,link
world of married couple ep next the world of the married next,https://subs.dog/subtitles/2230009/The-World-of-the-Married-A-World-of-Married-Couple-Couple-s-World-Boobooui-Sekye-/
kuning scoob webrip webdl hdrip everyagent scoob webrip webhd webdl hdrip amzn everyagent,https://subs.dog/subtitles/2230029/Scoob-/
eccentric chef moon episode 제멋대로 바캉스 eccentric chef moon next iqiyi,https://subs.dog/subtitles/2230001/Eccentric-Chef-Moon-Unique-Chef-Moon-Yoobyeolna-Moonshefu-/
scoob web hd pahe in indonesian scoob web hd pahe in scoob web hd pahe in scoob amzn web dl ddp ntg,https://subs.dog/subtitles/2230045/Scoob-/
world of married couple ep 부부의 세계 the world of married next viu 부부의 세계 world of married couple next viu,https://subs.dog/subtitles/2230005/The-World-of-the-Married-A-World-of-Married-Couple-Couple-s-World-Boobooui-Sekye-/
indo world of married couple ep next viu 부부의ㅡ세계 ㅡthe world of the married episode next viu,https://subs.dog/subtitles/2230013/The-World-of-the-Married-A-World-of-Married-Couple-Couple-s-World-Boobooui-Sekye-/
the world of the married 부부의ㅡㅡ세계ㅡㅡthe world of the married ep web dl viu,https://subs.dog/subtitles/2229824/The-World-of-the-Married-A-World-of-Married-Couple-Couple-s-World-Boobooui-Sekye-/
world of married couple ep next viu 부부의세계 the world of the married next viu sekyeㅡthe world of the married next,https://subs.dog/subtitles/2229805/The-World-of-the-Married-A-World-of-Married-Couple-Couple-s-World-Boobooui-Sekye-/
legend of awakening ㅡlegend of awakeninㅡep indo ㅡlegend of awakeninㅡep indo,https://subs.dog/subtitles/2229621/Legend-of-Awakening-The-Road-of-Awakening-Tian-Xing-Zhi-Lu-/
girl at my door korean bluray aac,https://subs.dog/subtitles/2229598/A-Girl-at-My-Door/
kuning to hell and gone webrip aac yts mx to hell and gone webrip aac yts mx,https://subs.dog/subtitles/2229529/To-Hell-and-Gone/
oh my baby ep 마이 베이비 oh my baby next viu,https://subs.dog/subtitles/2229203/Oh-My-Baby-O-Mai-Baeibi-/
oh my baby ep next viu ㆍ오 마이 베이비ㆍ ㆍoh my baby ep next viu ㆍ오 마이 베이비ㆍ ㆍoh my baby ep unknow viu,https://subs.dog/subtitles/2229191/Oh-My-Baby-O-Mai-Baeibi-/
fix you ep next viu 一영혼수선공一fix you next viu,https://subs.dog/subtitles/2229181/Fix-You-Soul-Repairer-Younghonsoosungong-/
hijau the invisible man semua brrip blurayrip bdrip www mkvbee com the invisible man semua brrip blurayrip bdrip www mkvbee com,https://subs.dog/subtitles/2229517/The-Invisible-Man/
oh my baby episode 마이 베이비 oh my baby next iqiyi,https://subs.dog/subtitles/2229169/Oh-My-Baby-O-Mai-Baeibi-/
oh my baby episode next iqiyi ㆍ오 마이 베이비ㆍ ㆍoh my baby ep next iqiyi ㆍ오 마이 베이비ㆍ ㆍoh my baby ep next iqiyi,https://subs.dog/subtitles/2229170/Oh-My-Baby-O-Mai-Baeibi-/
oh my baby ㆍ오 마이 베이비ㆍ ㆍoh my baby ep next,https://subs.dog/subtitles/2229013/Oh-My-Baby-O-Mai-Baeibi-/
legend of awakening ㅡlegend of awakeninㅡep indo ㅡlegend of awakeninㅡep indo,https://subs.dog/subtitles/2229007/Legend-of-Awakening-The-Road-of-Awakening-Tian-Xing-Zhi-Lu-/
to hell and gone webrip ac evo,https://subs.dog/subtitles/2228959/To-Hell-and-Gone/
oh my baby ep oh my baby 마이 베이비 ep by jasmineyusuf,https://subs.dog/subtitles/2228952/Oh-My-Baby-O-Mai-Baeibi-/
look out officer all bluray yts ganool kuning look out officer all bluray yts ganool,https://subs.dog/subtitles/2227360/Look-Out-Officer-Shi-xiong-zhuang-gui-/
the green mile brrip yify txt the green mile brrip yify,https://subs.dog/subtitles/2227258/The-Green-Mile/
my love enlighten me episode my love enlighten me episode,https://subs.dog/subtitles/2227239/My-Love-Enlighten-Me-Nuan-Nuan-Qing-Duo-Zhi-Jiao-/
ijo onward brrip blu ray bdrip www sebuah dongeng com onward semua brrip blurayrip bdrip www sebuah dongeng com,https://subs.dog/subtitles/2226754/Onward/
radio star ep next 황금어장 라디오스타 radio_star_e next viu 황금어장 라디오스타 radio_star_e next viu 황금어장 라디오스타 radio_star_e next viu 황금어장 라디오스타 radio_star_e next viu 황금어장 라디오스타 radio_star_e next viu 황금어장 라디오스타 radio_star_e next viu,https://subs.dog/subtitles/2226731/Radio-Star-/
bring me home fhdrip aac nondrm,https://subs.dog/subtitles/2226197/Bring-Me-Home/
la grande vadrouille don look now we re being shot at bluray,https://subs.dog/subtitles/2226179/Don-t-Look-Now-We-re-Being-Shot-At-La-grande-vadrouille-/
downhill bluray geckos downhill bluray geckos pahe ph,https://subs.dog/subtitles/2225957/Downhill/
running turtle korean webrip vxt 거북이 달린다 running turtle korean webrip vxt,https://subs.dog/subtitles/2225993/Running-Turtle-AKA-Turtle-Runs-Geobugi-dallinda-/
legend of awakening ep legend of awakening ep doramax,https://subs.dog/subtitles/2225930/Legend-of-Awakening-The-Road-of-Awakening-Tian-Xing-Zhi-Lu-/
hijau capone webrip webdl hdrip everyagent capone webrip webdl hdrip everyagent,https://subs.dog/subtitles/2225979/Capone/
the postcard killings bluray dts hd ma evo,https://subs.dog/subtitles/2225744/The-Postcard-Killings/
solusi liburan_ the big bang theory bluray pahe in the big bang theory complete bluray pahe in,https://subs.dog/subtitles/2225750/The-Big-Bang-Theory-Fifth-Season/
good casting ep next viu 굿캐스팅一good casting next viu 굿캐스팅一good casting unknow viu,https://subs.dog/subtitles/2226715/Good-Casting-Gootkaeseuting-/
girlfriend ep girlfriend,https://subs.dog/subtitles/2225361/Girlfriend-Lou-xia-nu-you-qing-qian-shou-/
hijau onward semua brrip blurayrip bdrip everyagent onward semua brrip blurayrip bdrip www mkvbee com,https://subs.dog/subtitles/2225362/Onward/
kuning jade dynasty chinese bluray aac vxt jade dynasty chinese bluray aac vxt,https://subs.dog/subtitles/2225191/Jade-Dynasty/
teks biru justice league dark apokolips war semua brrip blurayrip bdrip justice league dark apokolips war semua brrip blurayrip bdrip justice league dark apokolips war bluray pahe in,https://subs.dog/subtitles/2225164/Justice-League-Dark-Apokolips-War/
indonesian eng sub held in the lonely castle ep downsub com indonesian eng sub 清平乐 held in the lonely castle ep 主演 王凯 江疏影 任敏 downsub com,https://subs.dog/subtitles/2225192/Serenade-of-Peaceful-Joy-Lonely-city-closed-Gu-Cheng-Bi-Isolated-city-Held-in-the-Lonely-Castle-Qing-Ping-Le-/
indonesian eng sub held in the lonely castle ep downsub com indonesian eng sub 清平乐 held in the lonely castle ep 主演 王凯 江疏影 任敏 downsub com,https://subs.dog/subtitles/2225176/Serenade-of-Peaceful-Joy-Lonely-city-closed-Gu-Cheng-Bi-Isolated-city-Held-in-the-Lonely-Castle-Qing-Ping-Le-/
indonesian eng sub girlfriend ep tv downsub com indonesian eng sub 楼下女友请签收 顾云洲遇险 嘉怡机智救人 girlfriend ep 芒果tv青春剧场 downsub com,https://subs.dog/subtitles/2225177/Girlfriend-Lou-xia-nu-you-qing-qian-shou-/
three against the world three against the world dvdrip,https://subs.dog/subtitles/2225162/Three-Against-the-World/
space jam bluray psychd,https://subs.dog/subtitles/2224948/Space-Jam/
legends of the fall brrip aac luv,https://subs.dog/subtitles/2224926/Legends-of-the-Fall/
legionnaire trail aka the legion web dl ac evo,https://subs.dog/subtitles/2224377/The-Legion-Legionnaire-s-Trail-/
when my love blooms ep 화양연화 when my love blooms next viu,https://subs.dog/subtitles/2224343/When-My-Love-Blooms-The-Most-Beautiful-Moment-in-Life-Hwayangyeonhwa-Salmi-Kkochi-Dweneun-Soongan-/
curious george royal monkey web dl ac evo,https://subs.dog/subtitles/2224378/Curious-George-Royal-Monkey/
chuang ep part chuang ep,https://subs.dog/subtitles/2224195/Chuang-2020-Chuang-Zao-Ying-2020-Chuang-3-Produce-Camp-2020-2020-/
bumi manusia nf web dl ch pahe in indo,https://subs.dog/subtitles/2224224/Bumi-Manusia/
